{"artifacts":{"chart":{"binding_sha256":null,"state":"absent-blocking"},"images":{"binding_sha256":null,"state":"absent-blocking"},"licenses":{"binding_sha256":null,"state":"absent-blocking"},"locks":{"binding_sha256":null,"state":"absent-blocking"},"runtime":{"binding_sha256":null,"state":"absent-blocking"},"sbom":{"binding_sha256":null,"state":"absent-blocking"},"schemas":{"binding_sha256":null,"state":"absent-blocking"},"signatures":{"binding_sha256":null,"state":"absent-blocking"},"skills":{"binding_sha256":null,"state":"absent-blocking"},"source":{"binding_sha256":null,"state":"absent-blocking"},"supported_aws_matrix":{"binding_sha256":null,"state":"absent-blocking"},"vulnerabilities":{"binding_sha256":null,"state":"absent-blocking"}},"authority":"provisional-local-static-freeze-contract-only","blockers":["S4_11_NOT_ACCEPTED","S5_00_THROUGH_S5_03_NOT_ACCEPTED","RELEASE_CANDIDATE_BINDING_ABSENT","AUTHENTIC_ARTIFACT_EVIDENCE_ABSENT","SEPARATE_CAMPAIGN_APPROVAL_ABSENT"],"claims":{"campaign_authorized":false,"cloud_execution_observed":false,"production_ready":false,"rc_frozen":false,"release_eligible":false},"dependencies":{"s4_11":"unmet-blocking","s5_00_through_s5_03":"unmet-blocking"},"drift":{"baseline_binding_sha256":null,"current_state":"not-evaluable-no-authentic-baseline","invalidate_on_any_component_change":true,"invalidates_campaign_results":true,"invalidates_review_results":true,"requires_refreeze":true},"freeze_binding_sha256":null,"issue":367,"oauth":{"advertised":false,"refresh_token_path":"forbidden","status":"disabled-unadvertised"},"version":"cogs.stage5-rc-freeze-manifest/v1"}
